event_name,event_url,event_summary,full_address,region,presented_by_name,start_date,start_time,end_date,end_time,event_category
Build Smarter & Ship Faster with AI | Feat. Augment Code CEO & Docker EVP of Engineering and Product,https://lu.ma/cp771ces,"An interactive panel featuring Tushar Jain, EVP of Engineering & Product at Docker, and Guy Gur-Ari from Augment Code will explore how AI is set to revolutionize software development and deployment workflows with practical strategies and real-world insights. Engineering and tech leaders will gain valuable perspectives on integrating AI across the development lifecycle.","San Francisco, CA",Bay Area,,2025-07-17,06:30 PM,2025-07-17,08:30 PM,hackathon
"AI Talks at Qlay with Experts from TwelveLabs, Deloitte and Peppr AI (YC W25)",https://lu.ma/n79fdkzb,"Enterprise leaders and top startup founders will explore the latest AI startup trends and VC funding insights, featuring expertise from industry veterans.","San Francisco, CA",Bay Area,,2025-07-22,05:30 PM,2025-07-22,08:00 PM,hackathon
Frontiers of AI: Building with Google Gemini & DeepMind,https://lu.ma/0nxup545,"An exclusive event will gather over 300 experts including Google insiders, leading researchers, and startup founders to explore Gemini models, reinforcement learning, and AI reliability with insights from the Gemini and DeepMind teams. Attendees like ML engineers, product founders, and investors will dive into SRE best practices, developer tooling, and enterprise AI innovation through expert panels and demos.","Mountain View, CA",Bay Area,,2025-07-25,05:00 PM,2025-07-25,08:30 PM,hackathon
Bay Area AI Optimization & Security Meetup,https://lu.ma/elyvukqm,"The August academic salon will gather AI researchers and industry experts to dive into technical and ethical challenges of AI optimization and security, featuring lightning talks and in-depth Q&A sessions focused on scientifically-grounded AI safety discussions.","San Francisco, CA",Bay Area,,2025-08-06,05:30 PM,2025-08-06,08:00 PM,hackathon
Odoo Connect 2025,https://www.odoo.com/r/gVZ,"Odoo Connect will feature over 100 expert-led talks and interactive Q&A sessions, offering a deep dive into ERP solutions and business growth strategies, all while connecting with a global community of over 2,000 professionals and partners.","The Embarcadero, San Francisco, CA",Bay Area,,2025-09-04,09:00 AM,2025-09-05,05:00 PM,hackathon
